{
  "case_count": 18,
  "claim": {
    "badge_label": "Marked Bench 11.11 - marked-bench-contradiction-multihop v0.3.0",
    "not_claims": [
      "Not a safety certification.",
      "Not a general intelligence claim.",
      "Not comparable across different suite hashes.",
      "Not evidence of third-party adoption unless separately verified in the evidence ledger."
    ],
    "permitted_summary": "Public result on the pinned suite, version, and suite hash only.",
    "text": "ExampleExternalJsonl demo-1.0 scored 11.11 on The Marked Bench marked-bench-contradiction-multihop v0.3.0 using suite hash 07a2bb9c0e8356d1cdab98b5b1b35a3c8bd29beff695816dfb151dbb5f6d0d1f and release marked-bench-contradiction-standard-release-0.4.10. This is a public benchmark result, not a safety certification."
  },
  "created_at": 1780242707.0,
  "evidence": {
    "claim_url": "",
    "evidence_url": "",
    "publication_packet_path": "publication_packet.json",
    "publication_packet_sha256": "cafc55bd0c0070cb2a0325030e9e28f7001bd417b72cf5b6f26104a3e94f825a",
    "report_sha256": "9028699a80c286fb644d9a7212209d452c5e5e0cbc8303c06599fb4950017c83",
    "result_card_sha256": "e726577943559f5fcbef4eae2b1124664651af556f8e7fcb57e1413cfe4cd67c"
  },
  "failure_count": 10,
  "notes": "Checked example result claim for the publication packet workflow.",
  "overall_score": 11.11,
  "release_id": "marked-bench-contradiction-standard-release-0.4.10",
  "schema": "marked_bench.result-claim.v1",
  "standard_claims": {
    "full_publication_packet_required": true,
    "not_general_intelligence_claim": true,
    "not_safety_certification": true,
    "public_test_result": true,
    "result_card_required": true,
    "same_suite_hash_required": true,
    "third_party_adoption_requires_verified_evidence": true
  },
  "submitter": "The Marked Bench Examples",
  "suite_hash": "07a2bb9c0e8356d1cdab98b5b1b35a3c8bd29beff695816dfb151dbb5f6d0d1f",
  "suite_id": "marked-bench-contradiction-multihop",
  "suite_version": "0.3.0",
  "system_name": "ExampleExternalJsonl",
  "system_version": "demo-1.0",
  "validation": {
    "error_count": 0,
    "schema": "marked_bench.publication-packet-validation.v1",
    "valid": true,
    "warning_count": 0
  }
}